{
    "$schema": "https://json-schema.org/draft/2020-12/schema",
    "title": "ACR Client Credential Metadata v1",
    "type": "object",
    "additionalProperties": false,
    "required": [
        "schema_version",
        "credential_id",
        "name",
        "token_prefix",
        "org_id",
        "repository_scopes",
        "scopes",
        "created_at",
        "expires_at",
        "revoked_at",
        "last_used_at"
    ],
    "properties": {
        "schema_version": {
            "const": "acr_client_credential.v1"
        },
        "credential_id": {
            "type": "string",
            "minLength": 8,
            "maxLength": 256
        },
        "name": {
            "type": "string",
            "minLength": 1,
            "maxLength": 200
        },
        "token_prefix": {
            "type": "string",
            "pattern": "^fcacr_[A-Za-z0-9_-]{4,32}$"
        },
        "org_id": {
            "type": "string",
            "minLength": 1,
            "maxLength": 128
        },
        "repository_scopes": {
            "type": "array",
            "items": {
                "type": "string",
                "maxLength": 512
            },
            "uniqueItems": true
        },
        "scopes": {
            "type": "array",
            "minItems": 1,
            "items": {
                "enum": ["context:read", "evidence:read", "episode:write"]
            },
            "uniqueItems": true
        },
        "created_at": {
            "type": "string",
            "format": "date-time"
        },
        "expires_at": {
            "type": ["string", "null"],
            "format": "date-time"
        },
        "revoked_at": {
            "type": ["string", "null"],
            "format": "date-time"
        },
        "last_used_at": {
            "type": ["string", "null"],
            "format": "date-time"
        }
    },
    "$id": "https://contracts.fullchaos.dev/acr/v1/acr_client_credential.v1.schema.json"
}
